{
  "case_id": "copy_multi_effect_partial",
  "class": "adversarial",
  "contract_id": "fixture_copy.v1",
  "covers": [
    "multi_effect_rejected",
    "single_effect_limit"
  ],
  "expected": {
    "mutation_attempted": false,
    "rationale": "Stage 5 keeps fixture copy to one content-addressed effect; expanded multi-effect copy plans are rejected before mutation.",
    "recovery_required": false,
    "retry_disposition": "forbidden",
    "schema_valid": true,
    "success_exit_allowed": false,
    "target_mutation_permitted_in_stage1": false,
    "terminal_status": "rejected",
    "validator_results": [
      {
        "code": "plan.incomplete",
        "status": "fail",
        "validator_id": "phase.plan_v1"
      }
    ]
  },
  "preconditions": {
    "effect_1": "absent",
    "effect_2": "absent"
  },
  "stimulus": {
    "effect_count": 2,
    "plan_status": "rejected"
  },
  "vector_version": "1.0"
}
